{
  "schema_version": "2.0.0",
  "module": "quoteModule",
  "enabled": true,
  "source_files": ["quoteCommand.js"],
  "defaults": {
    "inheritance_mode": "deep_merge_with_command_overrides",
    "compatibility_mode": "legacy_and_v2_fields",
    "legacy_field_aliases": {
      "descricao": "description",
      "metodos_de_uso": "usage",
      "permissao_necessaria": "permission",
      "local_de_uso": "contexts",
      "informacoes_coletadas": "collected_data",
      "pre_condicoes": "requirements",
      "dependencias_externas": "dependencies",
      "efeitos_colaterais": "side_effects",
      "observabilidade": "observability",
      "privacidade": "privacy",
      "limite_uso_por_plano": "plan_limits",
      "argumentos": "arguments",
      "acesso": "access"
    },
    "command": {
      "enabled": true,
      "category": "midia",
      "version": "1.0.0",
      "stability": "stable",
      "deprecated": false,
      "replaced_by": null,
      "risk_level": "medium"
    },
    "requirements": {
      "require_group": false,
      "require_group_admin": false,
      "require_bot_owner": false,
      "require_google_login": true,
      "require_nsfw_enabled": false,
      "require_media": false,
      "require_reply_message": false,
      "legacy": {
        "requer_grupo": false,
        "requer_admin": false,
        "requer_admin_principal": false,
        "requer_google_login": true,
        "requer_nsfw": false,
        "requer_midia": false,
        "requer_mensagem_respondida": false
      }
    },
    "pre_condicoes": {
      "requer_grupo": false,
      "requer_admin": false,
      "requer_admin_principal": false,
      "requer_google_login": true,
      "requer_nsfw": false,
      "requer_midia": false,
      "requer_mensagem_respondida": false
    },
    "rate_limit": {
      "max": null,
      "janela_ms": null,
      "escopo": "sem_rate_limit_explicito"
    },
    "dependencies": ["canvas", "assets de emoji remotos"],
    "dependencias_externas": ["canvas", "assets de emoji remotos"],
    "responses": {
      "success": "Comando executado com sucesso.",
      "usage_error": "Formato de uso inválido. Consulte metodos_de_uso.",
      "permission_error": "Permissão insuficiente para executar este comando."
    },
    "respostas_padrao": {
      "sucesso": "Comando executado com sucesso.",
      "erro_uso": "Formato de uso inválido. Consulte metodos_de_uso.",
      "erro_permissao": "Permissão insuficiente para executar este comando."
    },
    "observability": {
      "event_name": "command.executed",
      "log_level": "info",
      "tags": ["whatsapp", "command", "quoteModule"]
    },
    "privacy": {
      "data_categories": ["chat_identifier", "sender_identifier", "command_content"],
      "retention_policy": "standard_app_logs",
      "legal_basis": "service_execution_and_legitimate_interest"
    },
    "access": {
      "premium_only": false,
      "allowed_plans": ["comum", "premium"]
    },
    "acesso": {
      "somente_premium": false,
      "planos_permitidos": ["comum", "premium"]
    },
    "plan_limits": {
      "comum": {
        "max": 4,
        "janela_ms": 600000,
        "escopo": "usuario"
      },
      "premium": {
        "max": 15,
        "janela_ms": 600000,
        "escopo": "usuario"
      }
    },
    "limite_uso_por_plano": {
      "comum": {
        "max": 4,
        "janela_ms": 600000,
        "escopo": "usuario"
      },
      "premium": {
        "max": 15,
        "janela_ms": 600000,
        "escopo": "usuario"
      }
    },
    "behavior_templates": {
      "toggle_on_off_status": {
        "type": "toggle",
        "allowed_actions": ["on", "off", "status"],
        "action_argument": "acao"
      },
      "add_remove_list": {
        "type": "list_management",
        "allowed_actions": ["add", "remove", "list"],
        "action_argument": "acao"
      },
      "approve_reject": {
        "type": "moderation_decision",
        "allowed_actions": ["approve", "reject"],
        "action_argument": "acao",
        "requires_targets": true
      },
      "set_status_reset": {
        "type": "configuration_window",
        "allowed_actions": ["set", "status", "reset"],
        "action_argument": "valor"
      }
    }
  },
  "commands": [
    {
      "name": "citar",
      "aliases": ["qc", "quote"],
      "descricao": "Transforma texto em figurinha estilo quote.",
      "metodos_de_uso": ["<prefix>citar seu texto", "<prefix>qc @usuario texto"],
      "permissao_necessaria": "usuario comum",
      "limite_de_uso": "sujeito a timeouts internos de renderizacao",
      "local_de_uso": ["privado", "grupo"],
      "informacoes_coletadas": ["identificador do chat (remoteJid)", "identificador do remetente (senderJid)", "texto do comando e argumentos", "contexto da mensagem (citacao e mencoes, quando existir)", "texto alvo da quote (digitado ou citado)", "mencoes para resolver autor/alvo da quote", "nome de exibicao e avatar para renderizacao"],
      "enabled": true,
      "categoria": "midia",
      "subcomandos": [],
      "argumentos": [
        {
          "nome": "texto",
          "tipo": "string",
          "obrigatorio": false,
          "validacao": "texto livre ou conteúdo de mensagem citada",
          "default": null
        }
      ],
      "pre_condicoes": {
        "requer_grupo": false,
        "requer_admin": false,
        "requer_admin_principal": false,
        "requer_google_login": true,
        "requer_nsfw": false,
        "requer_midia": false,
        "requer_mensagem_respondida": false
      },
      "rate_limit": {
        "max": null,
        "janela_ms": null,
        "escopo": "sem_rate_limit_explicito"
      },
      "dependencias_externas": ["canvas", "assets de emoji remotos"],
      "efeitos_colaterais": ["renderiza imagem temporária", "envia figurinha quote"],
      "respostas_padrao": {
        "sucesso": "Comando executado com sucesso.",
        "erro_uso": "Formato de uso inválido. Consulte metodos_de_uso.",
        "erro_permissao": "Permissão insuficiente para executar este comando."
      },
      "observabilidade": {
        "evento_analytics": "whatsapp_command_quote",
        "tags_log": ["whatsapp", "command", "quoteModule", "quote"],
        "nivel_log": "info"
      },
      "privacidade": {
        "dados_sensiveis": ["identificador do chat", "identificador do remetente", "conteudo textual do comando"],
        "retencao": "conforme políticas de logs, banco de dados e arquivos temporários da aplicação",
        "base_legal": "execução do serviço solicitado e legítimo interesse operacional"
      },
      "capability_keywords": ["citar", "qc", "midia", "privado", "grupo"],
      "faq_patterns": ["como usar citar", "o que faz citar", "comando citar"],
      "user_phrasings": ["quero usar citar", "me ajuda com citar", "transforma texto em figurinha"],
      "suggestion_priority": 100,
      "acesso": {
        "somente_premium": false,
        "planos_permitidos": ["comum", "premium"]
      },
      "limite_uso_por_plano": {
        "comum": {
          "max": 4,
          "janela_ms": 600000,
          "escopo": "usuario"
        },
        "premium": {
          "max": 15,
          "janela_ms": 600000,
          "escopo": "usuario"
        }
      },
      "mensagens_uso": {
        "default": ["🖼️ *Citar*", "", "Use assim:", "*<prefix>citar* sua mensagem", "", "Ou responda uma mensagem com:", "*<prefix>citar*"]
      },
      "id": "quote.citar",
      "description": "Transforma texto em figurinha estilo quote.",
      "usage": ["<prefix>citar seu texto", "<prefix>qc @usuario texto"],
      "docs": {
        "summary": "Transforma texto em figurinha estilo quote.",
        "usage_examples": ["<prefix>citar seu texto", "<prefix>qc @usuario texto"],
        "usage_variants": {
          "default": ["🖼️ *Citar*", "", "Use assim:", "*<prefix>citar* sua mensagem", "", "Ou responda uma mensagem com:", "*<prefix>citar*"]
        }
      },
      "permission": "usuario comum",
      "contexts": ["privado", "grupo"],
      "collected_data": ["identificador do chat (remoteJid)", "identificador do remetente (senderJid)", "texto do comando e argumentos", "contexto da mensagem (citacao e mencoes, quando existir)", "texto alvo da quote (digitado ou citado)", "mencoes para resolver autor/alvo da quote", "nome de exibicao e avatar para renderizacao"],
      "requirements": {
        "require_group": false,
        "require_group_admin": false,
        "require_bot_owner": false,
        "require_google_login": true,
        "require_nsfw_enabled": false,
        "require_media": false,
        "require_reply_message": false,
        "legacy": {
          "requer_grupo": false,
          "requer_admin": false,
          "requer_admin_principal": false,
          "requer_google_login": true,
          "requer_nsfw": false,
          "requer_midia": false,
          "requer_mensagem_respondida": false
        }
      },
      "arguments": [
        {
          "name": "texto",
          "type": "string",
          "required": false,
          "default": null,
          "enum": null,
          "description": "texto livre ou conteúdo de mensagem citada",
          "position": 0,
          "accepts_mentions": false,
          "accepts_reply_target": false,
          "greedy": false,
          "validation": "texto livre ou conteúdo de mensagem citada"
        }
      ],
      "behavior": {
        "type": "argument_driven",
        "allowed_actions": []
      },
      "limits": {
        "usage_description": "sujeito a timeouts internos de renderizacao",
        "rate_limit": {
          "max": null,
          "janela_ms": null,
          "escopo": "sem_rate_limit_explicito"
        },
        "access": {
          "somente_premium": false,
          "planos_permitidos": ["comum", "premium"]
        },
        "plan_limits": {
          "comum": {
            "max": 4,
            "janela_ms": 600000,
            "escopo": "usuario"